Company Name,ABN,Telephone,Facsimile,Address,Email,Website,Description
Integrated Design & Engineering Solutions,24 100 616 868, 8551 2000,," Unit 5, 2 - 4 Federation WayMentone VIC 3194",,http://www.ides.com.au/,"Integrated Design & Engineering Solutions Pty Ltd (IDES) is a wholly Australian owned company focusing on developing engineering solutions for land systems and vehicles. IDES capabilities are focused on project management, advanced engineering design (CAD), engineering analysis (CAE ï¾– FEA), and systems integration. IDES undertakes activities from initial tender response to concept and styling development, engineering development, release of engineering data pack, project management, project delivery, training and acceptance. IDES operates in the defence, emergency services and automotive market segments."
J C Smale & Sons Pty Ltd,30 351 687 180, 03 9544 7188, 03 9543 7927, 11- 23 Commercial RdNotting Hill VIC 3168,,http://www.jcsmale.com/,"As one of the worlds leading suppliers of automated equipment for the Heavy Clay industry, J C Smale & Co are committed to developing innovative, highly flexible systems using the latest technology to meet the growing demands of today's market. J C Smale is an Australian owned company founded in 1962, and since has brought together leading specialists in the Heavy Clay Industry to design, construct, install and commission a wide variety of equipment. These projects range from small modifications to existing plant to entire turnkey projects. We specialize in the manufacture of plant equipment in areas such as clay preparation, forming, setting and unloading of clay bricks, pavers and roof tiles. All design projects after carefully researched to determine the most appropriate solution. Our Mechanical and Electrical Engineers will ensure the equipment is designed using the latest technology, maximizing energy conservation and return on investment. In addition our team of experienced Installation and Commissioning Engineers are able to train the client operators and engineers on the equipment operation. After more than 40 years of industrial accomplishments, J C Smale continues to seek innovative means of helping the manufacturer face trends of global competition. We welcome the opportunity of sharing our experience and technology with you on your next capital investment. J C Smale have installed equipment throughout Australia as well as worldwide in countries such as United Kingdom, South Africa, USA, Russia, Thailand, China, Indonesia and Malaysia."
Jayco Corporation Pty Ltd,79301936497, 03 9791 6599, 03 9791 2825, 1 Jayco DriveDandenong VIC 3175,info@jayco.com.au,http://www.jayco.com.au,"Australia's most recognised brand for quality and affordable recreational vehicles, Jayco is a great success story of Australian manufacturing. Employing over 800 Australians, Jayco continues as a locally owned family business. Australia's premier manufacturer of recreational vehicles Jayco is Australia's largest manufacturer of recreational vehicles (RVs) with their range of Camper Trailers, Pop-Tops, Caravans and Motor homes which for the past 30 years have been the most popular choice for people who love to travel currently commanding approx. 44% of the overall market. Behind this 30 year success lies the Jayco strength and security. Our large modern manufacturing complex located within the City of Greater Dandenong has over 800 dedicated employees, and is still managed by the original founder. Jayco is clearly the leader in research and development within the RV industry, which continues to boom as more Australians choose to discover their country through experiencing the freedom of the Great Outdoors. Jayco's network of some 32 dealers and even more authorised service agents together with our 12 month Construction Warranty and Customer Care Card ensures peace of mind when you need it most - while travelling. Our spare parts department provides parts back up for both past and present Jayco's. For nearly 40 years we have built a reputation for high quality and excellent value for money. Since its humble beginnings, Jayco has built over 160,000 RVs for Australian's to enjoy."
JBO Engineering,, 03 9725 0688,, 2/2 Shelley CourtKilsyth VIC 3137,sales@jboengineering.com.au,https://www.jboengineering.com.au/,"JBO Engineering has vast expertise in CNC machining. Whether your job is a one-off or production run, we have the experience and knowledge to meet your expectations. With programming, machining, automated inspection and finishing available, we can take your job from concept to completion, with complete peace of mind. For precision engineering services from a team of experts, contact JBO Engineering today."
JDN Monocrane Pty Ltd,, 9797-6666, 9797-3022, 7-11 Nathan RoadDandenong VIC 3175,,http://www.jdn.com.au/,"Founded in 1979 JDN MONOCRANE was a small components manufacturer. When JDN MONOCRANE first entered the lifting equipment market it purchased hoists and components from overseas and fitted them to girders manufactured locally. You've come to the right place at JDN MONOCRANE, Australia's complete crane and hoist company. JDN MONOCRANE is a one stop solutions shop that can design, manufacture, install and service the full range of standard and specialised, customer specific crane solutions. We don't just build custom design cranes, we have a wide selection of readily available cranes for sale too. We are a proud wholly Australian owned and operated company with almost 35 years experience in the crane industry. When you purchase from us, you are buying an Australian designed and manufactured machine that supports local jobs and our local community. Founded in 1979 JDN MONOCRANE was a small components manufacturer. When JDN MONOCRANE first entered the lifting equipment market it purchased hoists and components from overseas and fitted them to girders manufactured locally. Dissatisfaction with the imported products led JDN MONOCRANE to start modifying them to suit specific customer needs. This substantially improved customer service, the finished product and further developed skill sets within JDN MONOCRANE. In the 1990's JDN MONOCRANE developed its own extensive range of hoists, end carriages and associated lifting products. These products have continued to evolve and to exceed customer and industry benchmarks. JDN MONOCRANE is now a one stop solutions shop that can design, manufacture, install and service the full range of standard and specialised, customer specific lifting solutions."
Jenkin Bros Engineers Australia Pty Ltd,14 006 988 530, 03 8727 6600, N/A, 6-8 Ramage StreetBayswater VIC 3153,frank@jenkin.com.au,http://www.jenkin.com.au,"Jenkin Bros Engineer's (Australia) Pty Ltd is proudly a 100% Australian owned company, offering a broad range of engineering services and components.
Melbourne based, our state of the art, 3000m2 engineering facility is located in the heart of Melbourne's eastern suburbs. Jenkin Bros has been a leader within its industry for more than 46 years - we are able to offer wide-ranging experience which has given us an astute ability to deliver sustainable quality performance time after time.
 Our Engineering Products and Services below is a sample of some of the diverse range of products and services.
We provide a broad range of engineering services including CNC Turning and Milling of steel, aluminium, plastics, brass and many other materials using modern equipment supported by the latest CadCam software. We have a full fabrication shop with Laser Cutting, Folding and  Welding.
We are also able to offer our clients a full range of services including all types of heat treatment, component surface finishes as well as decorative and protective finishes. We can also handle any assembly requirements
Our Anti Brake Skid Pole (Sensor) Rings are used widely in the heavy automotive industry.        We are the proud manufacturers of the impressive JENGRIP air-over-hydraulic machine tool vices which greatly enhance productivity in repetitive milling and drilling operations.
It is the policy of Jenkin Bros. Engineers to achieve maximum customer satisfaction by providing products that meet or exceed the specifications and expectations of our customers, and their customers, in every respect. In this regard Jenkin Bros has won numerous awards from its notable clients."
John Berends Implements Pty Ltd,79 007 035 369, 03 9791-2494, 03 9794 5568, 130 Frankston Dandenong RdDandenong VIC 3175,,http://www.johnberendsimplements.com.au/,"John Berends Implements have been manufacturing agricultural machinery for 50 years and have the enviable reputation for being one of the leaders in their field. Berends manufacture and sell predominantly tractor three point linkage mounted machines. The product range is wide and Berends is one of the largest manufacturers of this type in Australia and, more recently, New Zealand. The market position is a result of providing a strong and practical machine at a competitive price. Berends use quality components usually imported from reliable European manufacturers. In many cases, they use better quality components than the more expensive competitors. John Berends Implements have the widest range of linkage machinery in Australia with more than 150 different products. These include grader blades, slashers, post-hole diggers, post drivers, cultivators, mulchers and many more. Additionally, Berends are the sole manufacturers of the Gibbins Rawling range of disc cultivators. John Berends Implements Pty Ltd aim to continue providing strong, reliable and price competitive products well into the future. Despite a direct distribution to over 130 dealers throughout Australia, the company has maintained its close liaison with the farmer. This has resulted in a strong market focus with a better understanding of the farmers needs. With over 30 years experience in the agricultural business, Berends is the benchmark in agricultural machinery. John Berends Implements also have capabilities in thread rolling (up to 32mm), thread cutting (up to 50mm) and wire straightening. Email us for a free quote."
Kaishan Compressors,58 114 574 515, 1300 098 901, 03 8769 2801, 134-140 Atlantic DriveKeysborough VIC 3173,sales@kaishan.com.au,https://www.kaishan.com.au,"Kaishan Compressors (formerly Southern Cross Compressors (Aust) Pty Ltd) is the Australian division of the Kaishan Group of Companies, one of the largest and most advanced designers and manufacturers of compressed air products in the world."
Kingston City Council,80 640 377 247, 9581 4735,, 1230 Nepean HighwayCheltenham VIC 3192,business@kingston.vic.gov.au,http://www.kingston.vic.gov.au/Kingston-Business,"Kingston Council's Business Directions team provides a range of services to all types of businesses within the municipality to foster the development of an innovative, sustainabile and prosperous economy. These activities include:  Strategic Economic Planning  Regional Collaboration and Partnerships  Fostering Innovation and Technology Adoption  Business Education and Skill Development  Business Networking - Making Connections  Retail Precinct support  Business Sustainability  Advocacy - an effective voice for business To find out more about Kingston Council services contact (03) 9581 4735 or business@kingston.vic.gov.au"
Knox City Council,24 477 480 661, 03 9298 8000,, 511 Burwood HighwayWantirna South VIC 3152,,http://www.knox.vic.gov.au/page/HomePage.aspx,"Knox City Council provides services to help create and grow business and the local economy through 4 areas of strategic focus. 1. Understanding our Local Economy and Business Community Research and analysis of economic data, business visits to improve our knowledge of the aspirations and challenges of local businesses. 2. Supporting our Business Business Education and Events, providing opportunities for business networking. 3. Growing our Local Economy Attract new or additional investment to Knox, expand existing businesses, identify new business and investment opportunities, participate in partnerships and regional initiatives. 4. Enabling Prosperous Places Continue work under Council's Place Program and in areas of strategic importance such as Employment Precincts. The KnoxBiz website is your entry point to online services and information to help create and grow business and the local economy. Register to receive the latest information by visiting the KnoxBiz website."
Lake Engineering Pty Ltd,55 006 919 400, 03 9791 5440, 03 9793 7550," Factory 6, 15-17 Moneterey RoadDandenong South VIC 3175",,http://www.lakeengineering.com.au/,"Lake Engineering Pty Ltd, established for over 35 years, is a local family owned business. Our range of CNC Lathes and Machining Centres allow us to produce machined parts to extremely accurate tolerances, with fast and efficient turn around time. Utilizing state of the art Cadcam programming, allows us to upload and design your production requirements efficiently and accurately at competitive prices. We can offer short, medium and long run production supplying a wide range of industries including; aviation, mining and petroleum, automotive, hydraulics, marine, food and medical industries. Our capabilities allow us to work with all types of ferrous and non-ferrous metals as well as a wide range of plastics."
Laser 3D,47 058 026 314, 03 9792-9599, 03 9792 9676," Unit 2, 1368 Heatherton RoadDandenong VIC 3175",,http://www.laser3d.com.au/,"Laser Imaging was initially established to provide laser engraving services to a broad range of industries, utilising both YAG and CO2 laser engraving systems. Laser 3D was created as a division of Laser Imaging in 1992 to fill a void in the laser job shop market by providing the ability to trim formed metal and plastic components. During its rapid growth Laser 3D has installed 6 laser cutting systems in its Melbourne facility, giving the ability to provide a broad range of laser cutting and welding services. In 1999 Laser3D expanded into the Adelaide market by establishing Laser 3D (SA) Pty Ltd. Laser 3D (SA) has 5 laser cutting systems installed providing similar services to the Melbourne facility. Both the Melbourne and Adelaide operations have developed a wide customer base. This ranges from small one person companies to the large primary automotive producers. Quality Laser Imaging and Laser 3D have spent considerable time and resources developing its quality systems with an aim of providing our customers with superior service and products. These efforts culminated in accreditation to QS9000/ISO9002 at our Adelaide facility during 2000. Melbourne also achieved accreditation to QS9000 during 2004. Service As the laser cutting service is often just one stage in producing a finished product, Laser 3D recognise that customers deserve prompt and courteous service in quoting and delivery. To achieve the best possible service, Laser 3D has developed its own computer integrated manufacturing software. This software will now allow registered customers to obtain information on all past and present jobs including, pricing, current order status and past order statistics through this web site. Laser 3D can also provide additional services including folding and powder coating enabling us to supply completed products if required."
Leading Edge Energy,96163318045,481345181,, 1A/96 Buckingham StreetSurry Hills NSW 2010,e.beard@leadingedgeenergy.com.au,https://www.leadingedgeenergy.com.au/,Join the exclusive SEMMA group energy tender run in partnership with Leading Edge Energy.
Lepol Metal Work,76005771399, 03 9555 6112,, 53-55 De Havilland RdMordialloc VIC 3195,info@lepolmetal.com.au,https://lepolmetal.com.au/,"End-To-End Project Support.
Lepol supports your Mechanical services project from value management, design, fabrication then right through to delivery on-site and commissioning."
Liftech Handling and Access,20 069 953 993, 03 9706 5510,, 154-160 DIscovery RoadDandenong South VIC 3175,gary@liftech.com.au,https://www.liftechforklifts.com.au/,"New or Used Forklift & Access Equipment Hire and Sales Looking for short term or long term access equipment and forklift hire? Want to look at new or used forklifts and access equipment for sale? You've come to the right place! Liftech have been offering quality equipment and first class service for over 20 years! What are the benefits of forklift hire through Liftech?  We have been supplying rental equipment to Melbourne for more than 20 years, so we really know our stuff!  We offer both short-term and long-term rentals, from 1 day to 1 year, with flexible finance options.  We source forklifts from some of the most reputable and best-known manufacturers all around the world.  We have a range of models to choose from, including: electric, container mast and narrow aisle.  We employ our own skilled technicians, who take care of all repairs and maintenance for our forklifts.  We have forklifts with various fuel sources available, including: electric (suitable for indoor use), LPG and diesel.  We also have a range of accessories for hire, allowing you to further enhance the use of our machines."
LINAK Australia,87 062 249 450, 8796 9777, 8796 9778, 82-84 Abbott RoadHallam VIC 3803,,http://www.linak.com.au/,"LINAK Australia is a subsidiary of LINAK, an international company founded on a simple idea - electric linear actuation. As an OEM supplier, we develop and manufacture standard and customized, plug and play, actuator systems available in 12, 24 and 36V DC. The LINAK product line includes linear actuators, with lifting capacities from 200-10000 N, lifting columns, with height adjustments from 560-1235 mm, control units, featuring electronic overload protection, handsets and a wide range of accessories to be sold separately or as a system. The LINAK product range is divided into four segments: 1) MEDLINE & CARELINE systems for the hospital and care business 2) HOMELINE systems for companies producing comfort furniture 3) DESKLINE systems offer products dedicated to desk manufacturers 4) TECHLINE systems appeal to the interests of industrial manufacturers LINAK actuator systems have been approved according to the relevant Australian Standards. LINAK strives to develop and deliver high quality systems for a variety of diverse applications. Only your imagination sets the limits! When you choose LINAK, you choose a competent partner with great application and product know-how."
M. Brodribb Pty Ltd,, + 61 3 9832 0222,, 15 Carroll CrescentGlen Iris VIC 3146,sales@brodribb.com.au,http://www.brodribb.com.au/,"MB designs and builds power conversion systems for resource, electricity transmission & distribution, defence and infrastructure markets. We make battery chargers, cathodic protection rectifiers and power & instrument transformers to standard and customer requirements.
Our engineers use their experience to provide a tailored solution using the best technologies of Switchmode or Thyristor power conversion for your DC application. Our independence gives us the widest choice of elements from which to create the best solutions for our customers. Our ISO 9001:2015 certified factory is based in Glen Iris, Victoria where our quality policy is simple; â€œPride in our Productsâ€. Here, our skilled trades and engineers work to give you the smoothest project execution. We know that our products are robust and reliable, and we back this with our comprehensive warranty and lifetime product support."
M&S CNC MACHINING,64 489 439 664,356625884,," Factory5, No. 15 Cusack RdLeongatha VIC 3953",mark@mandscnc.com.au,http://www.mandscnc.com.au/,"Originating from the general engineering sector back in 1998, M&S CNC has forged itself a Niche in Precision production of Components in the Specialised areas of Aluminium and Stainless Steel.
Many Manufacturing problems have been solved for Australian Technology Companies through our diverse thinking and processing."
Mack Valves Pty Ltd,99094830145,397375200,, 30 Burgess RoadBayswater VIC 3153,sales@mackvalves.com,https://mackvalves.com/,"Mack Valves has been manufacturing valves in Melbourne Victoria for over 80 years and has supported a large range of industries, and built up a variety of solutions for different needs.  With those years of experience, Mack has become clearly focused across some core industries; Water Management, Cryogenic, General/Steam, Fire Protection, Defence and Oxygen Service, with a core product range to support each one."
Mackay Consolidated Industries,, 1300 020 374,, 894 Taylors RoadDandenong South VIC 3175,info@mackayrubber.com.au,https://www.mackayrubber.com.au/,"Mackay is Australiaâ€™s largest and most trusted designer, manufacturer, and distributor of a diverse range of engineered rubber and rubber composite products. Servicing both local and global automotive, defence, industrial, rail and technical markets."
Macpherson Kelly,19 122 450 337, 03 9794 2600, 03 9794 2550, 40 - 42 Scott StreetDandenong VIC 3175,,http://www.mk.com.au/,"At M+K our manufacturing team is passionately committed to ensuring Australian manufacturing stays viable, strong and most importantly, here. Some of our team comes from manufacturing backgrounds and they know what it's like out there and how they can help you. The team has expertise in: Intellectual Property + Trade  Brand protection strategies  Confidential information  Privacy issues  Distribution agreements  Licence Agreements  Terms and conditions of sale, purchase or tenders  Trade marks, patents, copyright, designs, advice and registration  Trade practices and ACCC issues and advice  International trade and Customs advice Workplace Relations  Advice about staff  Workplace agreements and workplace change  Employee, independent contractor and consultancy contracts  Restructuring and redundancies  OH&S and WorkCover  Discrimination and sexual harassment claims Disputes + Litigation  Investigations by the ACCC or ASIC  Commercial disputes with customers and suppliers  Faulty machinery  Property and leasing disputes  Enforcing intellectual property rights  Revenue     Debt recovery   Improve credit control procedures   Insolvency advice and disputes     Transaction + Property  Sales and acquisitions of businesses  Business structuring and tax advice  Agreements between business owners  Assisting with raising capital  Sales and acquisitions of commercial property  Documenting and advising on property leases Why are we different? We firmly believe that businesses are built on relationships. Therefore, building relationships with you is our business. We put this into practice by investing in ourselves so your business reaps the benefits, actively participating in industry to ensure your business reeives relevant advice, and by recommending a patth to take so your business can make quick by thoughtful decisions. You need lawyers that understand how their success relies on your success. You need lawyers that genuinely care. You need lawyers that are passionate about what they do - and about what you do. To find out more about M+K's Manufacturing expertise visit the industry page or to find out more about the Head of Manufacturing, James Sturgess, click here. M+K is a commercial law firm with offices in Victoria, New South Wales, Tasmania and Queensland. We have more than 50 Principals and 300 staff across four states."
MadeCo Australia,41 95 385 392, 03 9792 4321,, 34-38 Edison RoadDandenong South VIC 3175,,http://www.madeco.com.au/,"MadeCo Australia, is the leading suppliers of ready to assemble and assembled cabinetry for the trade. We pride ourselves on providing a business model that works along with the trade to supply customised cabinetry for each individual client needs, business tools such as quoting software and 3D drawing programmes that link with our manufacturing systems, a top quality showroom available for the trade to use as their own plus mentoring for the cabinetmaker or builder as the need arises. Our aim is to eliminate the unnecessary costs and overheads many cabinetmakers and builders have by providing a full solution to providing high quality Australian made cabinetry as one off jobs or large commercial projects."
Magna Plas Pty Ltd,35 005 691 350, 03 5979 4222,, 1/7 Bray StreetHastings VIC 3915,sales@magnaplas.com.au,https://magnaplas.com.au/,"Magna Plas Pty Ltd Victoria is a well-established Engineering Plastics & Plastics Manufacturing business, successfully launched in 1985.  Located on the Mornington Peninsula in Victoria, Australia, Magna Plas can supply all you with all your engineered plastic needs.  With knowledge and experience passed down from a family business that began in 1959, Magna Plas Victoria is proud we can supply you with your engineered plastic requirements while providing high quality products and exceptional customer service."
Manufacturing Insurance Brokers,79 640 560 201, 0429 400 026,, Level 10 / 14 Mason StreetDANDENONG VIC 3175,manufacturing@mclardymcshane.com.au,https://mmse.com.au/mib/,Manufacturing Insurance Brokers are a specialist division of McLardy McShane South East and deal exclusively with the Manufacturing sector. 
Mapien,, 03 9109 9800,," Level 7, 10 Queen StreetCBD VIC 3000",hello@mapien.com.au,https://www.mapien.com.au/,"We're celebrating our 40th Anniversary! For almost 40 years our workplace strategists have represented our clients in all aspects of workplace problems. We've mastered the art of designing, resourcing, & developing workplaces to enhance organisational performance & create people impact!"
