Company Name,ABN,Telephone,Facsimile,Address,Email,Website,Description
Marand Precision Engineering Pty Ltd,59004763688, 03 8552 0600,, 153 Keys RoadMoorabbin VIC 3189,sales@marand.com.au,https://www.marand.com.au/,"Marand is a privately owned Australian company with international clientele. We are a leading supplier to industry of high-quality precision tooling, machine tools and highly engineered automated production solutions. We have experience in most key manufacturing industries including automotive, aerospace, defence, mining, aviation, rail, food processing, white goods and general manufacturing. Marand's customer base is predominately Blue chip organisations including Lockheed Martin, Boeing, BAE Systems, Ford, BHP, Rio Tinto and Holden for which it designs and manufactures complex innovative equipment."
McKinna Group,51 088 110 169, 03 9580 4440,, 116 Malcolm RoadBraeside VIC 3195,sales@mckinnagroup.com.au,https://www.mckinnagroup.com.au,"McKinna deliver high quality fabricated products to a broad range of partners across Australia and Internationally, providing tailored solutions and services. With over 60 years of proven experience in metal services, continual investment into leading technologies, McKinna has become a leading metal product solution provider."
Melbourne Brick,68 123 372 396, 1300 722 102, 03 8786 4110, 227 Princes HwyHallam VIC 3803,,http://www.melbournebrick.com.au/,"Melbourne Brick is the leading outdoor products retailer in Melbourne. From bricks, pavers and retaining walls to a whole range of outdoor landscaping and design products, Melbourne Brick helps turns outdoor dreams into a dream outdoors. Melbourne Brick have a state of the art wet cast paving manufacturing plant at the HALLAM Head Office. Melbourne Brick have one of the leading ranges of artificial grass - Supernatural Grass; a range of water tanks and water storage solutions; shade solutions,landscaping products and landscape design solutions. From four display super stores at Hallam, Glen Iris, Bayswater and Hoppers Crossing, Melbourne Brick market to trade and retail customers."
Mescon,, 03 8566 8482,, PO Box 7Mentone VIC 3194,contactus@mescon.com.au,https://mescon.com.au/,"As system integrators, we provide solutions for the seamless integration of PLC, SCADA and MES to bridge the gaps between technologies, teams and areas of your plant site. We bring our expertise in automation & control systems engineering to assist you in unlocking Industry 4.0 and moving your factory into the era of smart manufacturing and beyond."
Metal Industries Insurance Brokers,15 006 568 501, (03) 9797 2913,," Suite 3, 73 Robinson StreetDandenong VIC 3175",info@miib.com.au,https://www.miib.au/,"Metal Industries Insurance Brokers (MIIB) specialise in arranging tailored, industry specific products and insurance programs exclusively for SME and corporate clients within the metal industry. We have a wealth of experience accumulated over many years in dealing with risks within the industry, and will provide you with specialist technical advice when reviewing your insurance program."
Metaltex Australia Pty Ltd,20 098 821 071, 9706 6106,, 18-24 Evolution DriveDandenong South VIC 3175,,http://metaltex.com.au/,"Metaltex is a privately-owned quality accredited manufacturing company and a leading OEM supplier to industry of high-quality precision manufactured steel products. We have experience in a wide range of key manufacturing industries and our partners span a variety of industries including, automotive, aerospace, defence, infrastructure, aviation, mining, energy, rail and rolling stock, food processing, entertainment, RV, point of sale water transfer and storage, agriculture, electronics and general manufacturing."
Micro Plastics Pty Ltd,43 521 963 958, 9793 6928, 9793 6982, 39-45 Nissan DriveDandenong South VIC 3175,sales@microplas.com.au,http://www.microplas.com.au,"Micro Plastics was established in 1977 as a custom injection moulder to the plastics industry. Micro Plastics was originally located in the Braeside area in Melbourne, VIC, but as demand grew, so did our number of moulding machines. To accommodate this, we relocated to purpose built premises in Dandenong South, Melbourne, VIC. We are now located in a 4,000 square metre building which houses 19 modern injection moulding machines ranging in size from 80 ton to 480 ton. Whilst Micro's main business has been in retail housewares they also produce items for the lighting, spa & pool, automotive & natural gas industries."
MJC Partners Pty Ltd,1234, 03 9794 8180,, 49 Robinson StreetDandenong VIC 3175,,http://www.mjca.com.au/,"MJC PARTNERS PTY LTD brings together people whose focus is to give you and your business the direction to tap into your true potential and create wealth and freedom. We are a business services company, designed to help you achieve your business development, financial and personal wealth creation goals. We are here to help you with your taxation and accounting requirements."
Mobile Automation,34076319376, 03 9761 8500,, 65 Canterbury RoadMontrose VIC 3765,craigtaylor@mobileautomation.com.au,http://www.mobileautomation.com.au/,"Whether its labour hire of a qualified electrician, a major electrical or automation project, plc programming, power factor correction, turn key robotic sysytems, solar installations..... or a host of other electrical solutions, Mobile Automation is your one-stop-shop. Utilising our in-house people & technology, we offer peace of mind to companies who seek professional, reliable and quality services for all electrical, automation and industrial robotic needs. Mobile Automation works collaboratively with you from initial concept right through to project completion and beyond."
Monash City Council,, 03 9518 3555,, 293 Springvale RoadGlen Waverley VIC 3150,mail@monash.vic.gov.au,http://www.monash.vic.gov.au/Home,"Monash is Victoriaâ€™s second largest employment destination, after the Melbourne CBD.  It is the intellectual and economic heart of Melbourne where universities, research institutions, and industry meet.  Currently with more than 20,000 businesses providing almost 130,000 jobs, this substantial economy is set to grow with the area recognised as a National Employment and Innovation Cluster."
Monash University,12377614012, 9902 0446,, Wellington RoadClayton VIC 3800,,http://www.monash.edu/,"Monash University is the largest university in Australia, ranked in the world's top 100 and a member of the prestigious Group of Eight. We're named after Sir John Monash, and fuelled by his desire for our students to leave here with a greater sense of purpose, and the skills and confidence to create positive change. In under 60 years, we've grown from a single campus into an education and research powerhouse with a presence on four continents, committed to the challenges of the age. Our work is making an impact all over the world, from bringing clean water to villages in Africa to creating new life-saving medicines. A desire to make a difference We're active in over 150 fields of research and work closely with government and industry. Many of our ideas - such as a new Malaria vaccine and 3D-printed engines and body parts- have been commercialised and are making a difference to the world we live in every day. Innovative partnerships Home to various precincts of innovation, we foster collaboration across traditional and unexpected disciplines. We build teams and form links, we bring together diverse minds - researchers, companies, businesses and technology - creating knowledge hubs of the future. Our rankings - We're in the world's top 100 universities (74th in the Times Higher Education World University Rankings 2016-2017) - 5 stars for staff qualifications and student retention (The Good Universities Guide 2017) - No. 1 in Australia for Engineering and Technology (Times Higher Education Rankings by Subject 2016) - Top 50 in the world for many disciplines including immunology, material science, pharmacology, social science and public health (USNWR Rankings by Subject 2016) - Voted No. 1 in Australia for graduate employability by local recruiters (Times Higher Education 2016-2017) Discover more at www.monash.edu"
Morgan Technical Ceramics,080 086 906, 03 9550 9137, 03 9550 9125, 4 Redwood DriveNotting Hill VIC 3168,,http://www.mtcmelbourne.com/,"Morgan Technical Ceramics Melbourne (MTC Melbourne) formerly Carpenter Advanced Ceramics, produces its world renowned MgO PSZ at its manufacturing facility in South East Melbourne, Australia. MTC Melbourne's MgO PSZ is used extensively throughout the severe service industry, combating wear and corrosion in a diverse range of applications. MTC Melbourne specialises in the production of wear and corrosion resistant components from its world renowned Nilcra Zirconia. We have been the leading producer of transformation toughened Zirconia ceramics for over 2 decades. Our strength is in providing customers with the means of designing and engineering highly cost effective solutions in Nilcra Zirconia. Offering a wide range of industrial wear and corrosion resistant components we can deliver high performance Zirconia ceramic solutions for applications in many industries such as oil and gas, automotive and commercial manufacturing. For over 2 decades we have specialised in working with customers to convert components made from convention material hardened metals and alloys to Zirconia Ceramic which increases product life by as much as 10-20 times. Morgan Technical Ceramics excels as a problem solver. We pride ourselves as a partner who is constantly seeking creative alternatives to traditional methods and materials. Many customers come to us first with new challenges, knowing that we have the expertise and the inventiveness to see possibilities rather than limits."
Mornington Peninsula Shire,, 1300 850 600,, 90 Besgrove StreetRosebud VIC 3939,customerservice@mornpen.vic.gov.au,https://www.mornpen.vic.gov.au/Home,"Mornington Peninsula Shire is responsible for more than 70 services from family and childrenâ€™s services, traffic regulation, open space, youth facilities, waste management and community building; to matters concerning business development, planning for appropriate development and ensuring accountability for Councilâ€™s budget. This broad range of community services and infrastructure for residents supports the wellbeing and prosperity of our community."
Morrows Logistics,, 03 9767 2600,, 150-160 Bridge RoadKeysborough VIC 3173,enquiries@morrowslogistics.com.au,https://www.morrowslogistics.com.au/,"Morrows Logistics is located in the South East of Melbourne and is one of Victoriaâ€™s leading Logistics companies. Specialising in regional transport, we provide a daily service to all areas of Victoria, Southern NSW and South Eastern SA with our own fleet of vehicles, ranging in size from vans to semi-trailers and b-double truck transport."
Morse Air Systems,65789459635, 03 9758 7733,397582366, 5 DempsterFerntree Gully VIC 3156,,http://www.morseairsystems.com.au/,"Morse Air Systems is a fully Australian owned and operated company offering products and services for all Industrial Air Movement Applications. At Morse Air Systems we employ different designs, different materials and unique approaches to solve a wide range of air movement situations. We design and manufacture an extensive range of industrial fans and blowers. This, coupled with our installation and maintenance services, enable us to provide the complete package for our customers."
National Australia Bank,12 004 044 937, 9767 9610, 1300 553 171, 3 Ordish RoadDandenong South VIC 3175,,http://www.national.com.au/,"Statement of Corporate Principles: These principles outline the way we do things at the National in all parts of our business. They have been developed to create and deliver consistently superior value to our: Shareholders Customers Employees Communities Our core beliefs and values are based on the following principles:- We will be open and honest We take ownership and hold ourselves accountable (for all of our actions) We expect teamwork and collaboration across our organisation for the benefit of all stakeholders We treat everyone with fairness and respect We value speed, simplicity and efficient execution of our promises"
Nestadt Consulting,,418330948,, 7 Henderson AvenueMalvern VIC 3144,kevin@nestadt.com.au,https://www.nestadt.com.au/,"Nestadt Consulting was established in 1989 by Kevin Nestadt who has eighteen years management consulting experience and eleven years' experience as CEO of a successful manufacturing business, 'Mackay Trailers', based in Melbourne's Southern suburbs and was a long time SEMMA member. Nestadt Consulting offers consultancy services and specialist expertise in the following areas:    Board and Management Level Advice      Strategic Business Turnaround & Process Improvement Support      Business Diagnostics, Strategy and Planning    Operational Performance Improvement with a Focus on ""Lean"" methodologies Nestadt Consulting aims to challenge the status quo in the client's organisation, and facilitate learning and change, bringing specialist expertise to bear on the outcome. Kevin is an effective listener, a good communicator & has an inclusive style - enabling him to get traction and effective change in organisations. He has detailed process improvement knowledge, business knowhow, good facilitative & people skills, as well as follow through ""to get the job done"". Kevin holds a Bachelor of Science in Mechanical Engineering, and a Master of Science in Industrial Engineering, both from the University of the Witwatersrand, Johannesburg."
New Touch Industries,, 03 9720 8248,, Cnr Malvern Street & Edelmaier StreetBayswater VIC 3153,sales@ntiv2.com.au,https://www.newtouchfab.com.au/,"New Touch Industries is certified to ISO 9001 and employ approximately 65 staff operating over multiple sites in Victoria, our skilled welders are certified to AS 1554."
Nissan Casting Australia P/L,25 005 092 704, 03 9797 4020, 03 9797 4060, 209-235 Frankston-Dandenong RoadDandenong VIC 3175,,https://semma.com.au/member/nissan-casting-australia-p-l/,Nissan Casting Australia Plant (NCAP) is a subsidiary of Nissan Motor Company Australia. The Nissan Casting Plant team aim to develop a centre of excellence across Asia through incorporating Nissan's global manufacturing principles 'Kaizen' and developing close working relationships with suppliers. Our casting production facility is a unique environment that is not aligned to a vehicle assembly.
Nitto Denko (Australia) Pty Ltd,69 002 483 945, 03 9799 3100, Visit Website â†’, 46-50 Remington DriveDandenong South VIC 3175,,http://www.nitto.com/,"Nitto Denko Australia was established in 1982. We pride ourselves in contributing value creation and innovation through enhanced engagement and by aligning the right product to amaze and inspire our customers. By utilizing the four core technologies of the Nitto Group; Adhesion, Coating, Polymer Function Control and Polymer Analysis & Evaluation, Nitto Australia offers our customers a variety of innovative products across 70 business fields within Building & Construction, Transportation, Life Sciences, Agricultural, Aerospace and Consumer Goods. Our strength lies in our ability to anticipate challenges, exercise curiosity, leverage change and take a bold step forward. We are driving growth and stimulating demand by constantly creating new products and developing new applications in the domains of Green (environment), Clean (new energy) and Fine (life sciences). Our commitment to innovation and originality are core components of our company philosophy."
Norden Body Works,, 9793 1066, 9794 5840, 62 Bennet StreetDandenong VIC 3175,reception@norden.com.au,http://www.norden.com.au,"Since it's conception in 1959, Norden has established itself as a market leader in the vehicle access, customised body building and hydraulic industries. Founded by Mr Ronald Anson, Norden Body Works initially designed, engineered and built commercial truck bodies for the transport industry. Due to massive growth and demand, Norden Body Works expanded it's range to include chassis modifications, specialised tipping bodies, custom built semi-trailers, curtain side bodies and hydraulic agricultural spray booms. In 1982 Norden Body Works diversified, creating Norden Conversion. This division of Norden focuses on the need for vehicles that provides wheelchair access to the wider community. Now the bench mark in our industry, Norden Conversion continues to broaden it's services with an ever increasing variety of vehicle modifications. 1986 saw the inauguration of Norden Hydraulic Connections, supplying fluid conveying products to the mining, petroleum, manufacturing, military and high performance industries. To augment it's already vast range, Norden Hydraulic Connections also stock cargo control systems for road, rail and air transportation. Already an integral product line, the Kwikee electric step has become a staple addition to many Norden Conversion customers. Established as the premier RV component supplier in the USA, the Kwikee product range is vast and comprehensive. With innovative designs for cargo slides to automatic leveling systems, the local leisure vehicle industry is now supported through Norden's continuous commitment to service. Norden,"" A proud tradition since 1959""."
Nu-line Windows,51059124319,397920083,397920087, 10 Arctic CourtKeysborough VIC 3173,info@nulinewindows.com.au,https://nulinewindows.com.au,"Nu-Line Windows is an Australian-owned company dedicated to providing quality made-to-measure commercial aluminium windows and doors for homes and commercial buildings. We specialise in the following products:  Bifold doors and windows  Frameless glass bifold doors  Stackable and sliding doors  and other operable commercial windows and doors. We have been working in the industry for many years now so our technical knowledge is unparalleled. So, if you have any questions or simply just require some advice our team is more than happy to help. What sets us apart from our competitors is our ability to manufacture large customisable windows and doors because we only use quality commercial/architectural aluminium extrusions and hardware. This is great for showing off views, creating a great atmosphere and ensuring durability. We manufacture everything ourselves which allows us to offer our customers a high degree of customisation which our competitors simply cannot. Similarly, we also have dedicated experienced installation teams should you require us to install. Feel free to browse our website for more information and photos. Our blog page continually gets useful and helpful content added to it, so feel free to browse through that too. Should you have any questions please do not hesitate to contact us as our friendly team are more than happy to help. If you would like to request a free no obligation quote you can simply go to the contact us page and fill out the form as necessary, send us an email or call us. Don't forget we have a showroom at our head office should you wish to come and inspect our product in person and meet our team."
Numiscon,32 081 592 467, 0419 588 095,, Ascot StreetDoncaster East VIC 3109,john.tsoucalas@numiscon.com,https://www.numiscon.com/,"With over 30 yearsâ€™ experience in technology commercialisation and export marketing, we can help you grow your business and maximise government Manufacturing and R&D grants for your process or innovative product.
â€¢	Manufacturing strategy support and assistant with Government Grants
â€¢	R&D Product Strategies and assistance with Government grants
â€¢	Commercialisation strategy development"
o.d.t. Engineering Pty Ltd,27 006 369 348, 9706 4135, 9706 4152, 521 Hammond RoadDandenong VIC 3175,accounts@odt.com.au,http://www.odt.com.au,"o.d.t. Engineering specializes in the design, manufacture and supply of high quality casting equipment, material handling equipment and services for Aluminum & Magnesium Industries throughout the world. Products include Ingot casting, stacking and strapping equipment; Billet casting equipment; Refractory products; Consumables and spare parts for casthouses. o.d.t. Engineering is a participant in the Cooperative Research Centre for Cast Metals Manufacturing (CAST), a leading light metal casting technology research centre. The comprehensive experience of CAST and the vast knowledge and experience of the o.d.t. Team is a unique combination. This co-operation between CAST and o.d.t. assists o.d.t. Engineering to remain at the leading edge of technology and ensures the latest technology in Aluminium casthouse equipment is readily available for our clients in the rapidly growing aluminium industry. Our own manufacturing company enables o.d.t. Engineering to fully control quality and ensure prompt delivery of its products. The manufacturing company provides the base for o.d.t. Engineering to complement its design expertise. o.d.t. Engineering has seen sustained growth over the years and has contributed to the success of a number of major projects in terms of design excellence, manufacturing quality, installation, commissioning and completion within time and cost limits. The acquisition of a manufacturing company - Ajay Engineering - in 1987 enabled o.d.t. Engineering to fully control the quality and ensure prompt delivery of its products. The new company gave o.d.t. Engineering a manufacturing base to complement its design expertise. Further staff recruitment has enhanced the company's expertise in the design and manufacture of casthouse equipment and services. Ajay Engineering Co. specialises in the design, manufacture and repair of a wide variety of equipment in the engineering and manufacturing industries throughout Australia and worldwide. Our experienced and professional team is dedicated to providing our customers with quality, cost efficient service in an economical time frame. Our well-equipped workshops includes fabrication, machining and fitting, which allows us to complete turnkey projects or jobbing work for both large and small companies and individuals."
Open Welding,, 0403 051 180,, 7 Clapham RoadHughesdale VIC 3166,Malcolm@icaruslearning.com,https://openwelding.com/,"Open Welding is an Australian owned and operated innovator, helping supply chains of welded product meet specifications locally, remotely or globally, 24/7."
Options Consulting Group,, 03 9693 9300,," Level 3, 20-22 Albert RoadSouth Melbourne VIC 3205",contactus@optionsgroup.com.au,https://www.optionsgroup.com.au/,Options Consulting Group's mission is to assist business realise full potential and facilitate growth. Our consultative approach is trusted long-term partner of business through delivering processes and outcomes to address the needs of all stakeholders.
Outerspace Design,97057888552, 03 9427 0355, 03 9428 2088, 50 Duke StreetAbbotsford VIC 3067,hello@outerspace.co,http://www.outerspace.co/,"Product Design and Engineering
Outerspace Design has helped hundreds of Australian brands, including small startups and large companies, excel on the world stage."
P1 Technology,20 111 097 824, 03 9874 5473,, 208 / 142-144 Greens RoadDandenong South VIC 3175,luke@p1technology.com.au,https://www.p1technology.com.au,P1 Technology takes the stress out of business technology with people-driven Managed IT solutions.
Parish Engineering Pty Ltd,, 03 9555 3377,, 48-50 Levenswell RoadMoorabbin VIC 3189,sales@parishengineering.com.au,https://www.parishengineering.com.au/,"Parish Engineering is a family owned, Australian repetition engineering company, manufacturing quality precision components in Moorabbin, Victoria. The company is in the enviable position of being small enough to offer personal contact with the owners of the business, yet large enough to provide the most sophisticated technology available."
PIER Marketing Group Pty Ltd,32602947795,359753742,, 3/2a Carbine WayMornington VIC 3931,alex@piermarketing.com.au,https://www.piermarketing.com.au/,"PIER Marketing is your full-service outsourced marketing agency. Our experienced team elevates brands through strategically driven marketing activity and aspirational design. All to achieve organisational growth.
We deliver marketing across a range of industries from professional services to manufacturing, construction and wholesale to wellbeing as well as government and not-for-profit to name a few. We operate across both B2B and B2C.
By applying our own standards as ex-clients, we ensure that all our marketing and advertising services are cost-effective, customer-centric and consistently aligned to your business goals. If it isnâ€™t, we wonâ€™t do it."
Plasmac (Plastic Machining), 81 109 901 237, 03 9543 6464, 03 9543 4324, 26 Cleeland RoadOakleigh South VIC 3167,sales@plasmac.com.au,http://plasmac.com.au/,"Plasmac are suppliers, manufacturers and fabricators of an extensive range of Engineering and Industrial plastics."
